{
  "$schema": "https://json-schema.org/draft/2020-12/schema",
  "$id": "https://schemas.codestra.dev/document-intelligence/v1/reviewed-result.schema.json",
  "title": "Confirmed DR driver licence result for persistence",
  "description": "Contract version 1.0.0. See architecture and privacy requirements in the package documentation.",
  "type": "object",
  "properties": {
    "scan_id": {
      "$ref": "#/$defs/id"
    },
    "tenant_id": {
      "$ref": "#/$defs/id"
    },
    "schema_version": {
      "const": "1.0.0"
    },
    "country": {
      "const": "DO"
    },
    "document_type": {
      "const": "driver_licence"
    },
    "status": {
      "const": "confirmed"
    },
    "document_hash": {
      "$ref": "#/$defs/documentHash"
    },
    "document_hash_key_id": {
      "$ref": "#/$defs/id"
    },
    "document_last4": {
      "$ref": "#/$defs/last4"
    },
    "fields": {
      "$ref": "#/$defs/reviewedFields"
    },
    "review": {
      "type": "object",
      "properties": {
        "reviewer_id": {
          "$ref": "#/$defs/id"
        },
        "reviewed_at": {
          "$ref": "#/$defs/timestamp"
        },
        "method": {
          "type": "string",
          "enum": [
            "human",
            "policy"
          ]
        }
      },
      "required": [
        "reviewer_id",
        "reviewed_at",
        "method"
      ],
      "additionalProperties": false
    }
  },
  "required": [
    "scan_id",
    "tenant_id",
    "schema_version",
    "country",
    "document_type",
    "status",
    "document_hash",
    "document_hash_key_id",
    "document_last4",
    "fields",
    "review"
  ],
  "additionalProperties": false,
  "$defs": {
    "date": {
      "type": "string",
      "format": "date",
      "minLength": 10,
      "maxLength": 10,
      "pattern": "^[0-9]{4}-[0-9]{2}-[0-9]{2}$"
    },
    "documentHash": {
      "type": "string",
      "minLength": 1,
      "maxLength": 76,
      "pattern": "^hmac-sha256:[0-9a-f]{64}$"
    },
    "id": {
      "type": "string",
      "minLength": 1,
      "maxLength": 128,
      "pattern": "^[A-Za-z0-9][A-Za-z0-9._:-]{0,127}$"
    },
    "last4": {
      "type": "string",
      "minLength": 1,
      "maxLength": 4,
      "pattern": "^[0-9]{4}$"
    },
    "reviewedFields": {
      "type": "object",
      "properties": {
        "full_name": {
          "type": "string",
          "minLength": 1,
          "maxLength": 200,
          "pattern": "\\S"
        },
        "address": {
          "anyOf": [
            {
              "type": "string",
              "minLength": 1,
              "maxLength": 500,
              "pattern": "\\S"
            },
            {
              "type": "null"
            }
          ]
        },
        "height": {
          "anyOf": [
            {
              "type": "number",
              "minimum": 0.3,
              "maximum": 3,
              "description": "Normalized metres."
            },
            {
              "type": "null"
            }
          ]
        },
        "weight_lb": {
          "anyOf": [
            {
              "type": "number",
              "minimum": 1,
              "maximum": 1500
            },
            {
              "type": "null"
            }
          ]
        },
        "sex": {
          "anyOf": [
            {
              "type": "string",
              "enum": [
                "M",
                "F",
                "X"
              ]
            },
            {
              "type": "null"
            }
          ]
        },
        "blood_type": {
          "anyOf": [
            {
              "type": "string",
              "enum": [
                "A+",
                "A-",
                "B+",
                "B-",
                "AB+",
                "AB-",
                "O+",
                "O-"
              ]
            },
            {
              "type": "null"
            }
          ]
        },
        "birth_date": {
          "anyOf": [
            {
              "$ref": "#/$defs/date"
            },
            {
              "type": "null"
            }
          ]
        },
        "issue_date": {
          "anyOf": [
            {
              "$ref": "#/$defs/date"
            },
            {
              "type": "null"
            }
          ]
        },
        "expiry_date": {
          "anyOf": [
            {
              "$ref": "#/$defs/date"
            },
            {
              "type": "null"
            }
          ]
        },
        "category": {
          "anyOf": [
            {
              "type": "string",
              "minLength": 1,
              "maxLength": 20,
              "pattern": "^[A-Z0-9][A-Z0-9 ./-]{0,19}$"
            },
            {
              "type": "null"
            }
          ]
        },
        "restriction": {
          "anyOf": [
            {
              "type": "string",
              "minLength": 1,
              "maxLength": 200,
              "pattern": "\\S"
            },
            {
              "type": "null"
            }
          ]
        },
        "first_issue_date": {
          "anyOf": [
            {
              "$ref": "#/$defs/date"
            },
            {
              "type": "null"
            }
          ]
        },
        "card_serial": {
          "anyOf": [
            {
              "type": "string",
              "minLength": 1,
              "maxLength": 40,
              "pattern": "^[A-Za-z0-9][A-Za-z0-9-]{0,39}$"
            },
            {
              "type": "null"
            }
          ]
        }
      },
      "required": [
        "full_name",
        "address",
        "height",
        "weight_lb",
        "sex",
        "blood_type",
        "birth_date",
        "issue_date",
        "expiry_date",
        "category",
        "restriction",
        "first_issue_date",
        "card_serial"
      ],
      "additionalProperties": false
    },
    "timestamp": {
      "type": "string",
      "format": "date-time",
      "maxLength": 40,
      "pattern": "^\\d{4}-\\d{2}-\\d{2}T\\d{2}:\\d{2}:\\d{2}(?:\\.\\d{1,6})?Z$"
    }
  }
}
